{
  "$schema":"https://json-schema.org/draft/2020-12/schema",
  "$id":"knowledge/skyfest-faq-1330-core-five-fact-snapshot.schema.json",
  "type":"object","additionalProperties":false,
  "required":["snapshot_format","snapshot_id","source_id","source_url","retrieved_at","capture_policy","facts","non_claims"],
  "properties":{
    "snapshot_format":{"const":"fact_limited_official_support_snapshot_v1"},
    "snapshot_id":{"const":"tgc_faq_1330_skyfest_core_five_2026_08_17"},
    "source_id":{"const":"source_tgc_faq_1330_skyfest_core_five"},
    "source_url":{"const":"https://thatgamecompany.helpshift.com/hc/en/17-sky-children-of-the-light/faq/1330-patch-notes---july-2-2024---0-26-0-272243-android-huawei-ios-playstation-steam-272595-switch/"},
    "retrieved_at":{"type":"string","format":"date"},"capture_policy":{"type":"string","minLength":1},
    "facts":{"type":"object","additionalProperties":false,"required":["historical_window_start_date","historical_window_end_date","new_items","numbered_items_scheduled_only_this_year"],"properties":{
      "historical_window_start_date":{"const":"2024-07-12"},"historical_window_end_date":{"const":"2024-07-26"},
      "new_items":{"const":[
        {"item_id":"item_skyfest_jenova_fan","official_name_en":"SkyFest Jenova Fan","original_currency":"event_currency","original_cost":7},
        {"item_id":"item_skyfest_5th_anniversary_tshirt","official_name_en":"SkyFest 5th Anniversary T-shirt","original_currency":"event_currency","original_cost":10},
        {"item_id":"item_skyfest_star_jar","official_name_en":"SkyFest Star Jar","original_currency":"event_currency","original_cost":15},
        {"item_id":"item_skyfest_oreo_headband","official_name_en":"SkyFest Oreo Headband","original_currency":"USD","original_cost":4.99},
        {"item_id":"item_skyfest_wireframe_cape","official_name_en":"SkyFest Wireframe Cape","original_currency":"USD","original_cost":19.99}
      ]},
      "numbered_items_scheduled_only_this_year":{"const":["item_skyfest_5th_anniversary_tshirt","item_skyfest_wireframe_cape"]}
    }},
    "non_claims":{"type":"array","minItems":1,"items":{"type":"string","minLength":1}}
  }
}
