{
  "snapshot_format":"fact_limited_official_support_snapshot_v1",
  "snapshot_id":"tgc_faq_1330_skyfest_core_five_2026_08_17",
  "source_id":"source_tgc_faq_1330_skyfest_core_five",
  "source_url":"https://thatgamecompany.helpshift.com/hc/en/17-sky-children-of-the-light/faq/1330-patch-notes---july-2-2024---0-26-0-272243-android-huawei-ios-playstation-steam-272595-switch/",
  "retrieved_at":"2026-08-17",
  "capture_policy":"Structured, fact-limited transcription of FAQ 1330's five named SkyFest new-item entries, their stated historical costs, the SkyFest 2024 window, and the numbered-item statement applicable to two included entries. No HTML, images, storefront state, account data, or full-page text is retained.",
  "facts":{
    "historical_window_start_date":"2024-07-12",
    "historical_window_end_date":"2024-07-26",
    "new_items":[
      {"item_id":"item_skyfest_jenova_fan","official_name_en":"SkyFest Jenova Fan","original_currency":"event_currency","original_cost":7},
      {"item_id":"item_skyfest_5th_anniversary_tshirt","official_name_en":"SkyFest 5th Anniversary T-shirt","original_currency":"event_currency","original_cost":10},
      {"item_id":"item_skyfest_star_jar","official_name_en":"SkyFest Star Jar","original_currency":"event_currency","original_cost":15},
      {"item_id":"item_skyfest_oreo_headband","official_name_en":"SkyFest Oreo Headband","original_currency":"USD","original_cost":4.99},
      {"item_id":"item_skyfest_wireframe_cape","official_name_en":"SkyFest Wireframe Cape","original_currency":"USD","original_cost":19.99}
    ],
    "numbered_items_scheduled_only_this_year":["item_skyfest_5th_anniversary_tshirt","item_skyfest_wireframe_cape"]
  },
  "non_claims":[
    "Anniversary Headband is deliberately outside this five-item cohort.",
    "This historical FAQ does not establish current availability, a return policy, current storefront state, or permanent-account property for any item.",
    "The FAQ does not provide formal Traditional Chinese names or image assets, and its text does not establish a visual match.",
    "This bounded FAQ slice is not a complete SkyFest or Anniversary set and no bundle or set membership is asserted."
  ]
}
